Dish Name,Ingredients,Cluster,Cluster_Label
pasta carbonara,"tomato sauce, olive oil, pasta, basil",1,Desserts & Pastries
japanese ramen,"egg, broth, scallions, noodles, pork, ginger",4,Asian & Stir Fry
sushi,"salmon, seaweed, soy sauce, avocado, rice",2,Curries & Stews
dim sum,"ginger, pork, soy sauce, shrimp",4,Asian & Stir Fry
clam chowder,"cream, clam, potato, onion",1,Desserts & Pastries
omelette,"pepper, onions, eggs, cheese",5,Breakfast & Brunch
lasagna,"onion, garlic, pasta, tomato sauce, ground beef, cheese",1,Desserts & Pastries
shawarma,"cumin, garlic, chicken, pita, yogurt",2,Curries & Stews
shawarma,"cumin, chicken, yogurt, garlic",2,Curries & Stews
greek salad,"olives, feta cheese, lettuce, tomato, cucumber",6,Grilled & Roasted
turkey sandwich,"bread, tomato, cheese, turkey",6,Grilled & Roasted
cereal,"fruits, nuts, milk, honey",0,Salads & Wraps
turkey sandwich,"lettuce, turkey, tomato, cheese, bread",6,Grilled & Roasted
chicken biryani,"spices, yogurt, rice, saffron, chicken",2,Curries & Stews
chicken biryani,"cardamom, saffron, spices, chicken",2,Curries & Stews
dim sum,"ginger, dumpling wrapper, pork, soy sauce",4,Asian & Stir Fry
greek salad,"cucumber, olives, tomato, feta cheese, lettuce, dressing",6,Grilled & Roasted
pad thai,"rice noodles, egg, peanut, shrimp, lime",3,Baked Dishes
japanese ramen,"pork, noodles, ginger, broth, egg",4,Asian & Stir Fry
tacos,"salsa, tortilla, lettuce, cheese",6,Grilled & Roasted
japanese ramen,"ginger, egg, noodles, broth",4,Asian & Stir Fry
pho,"lime, broth, chili, basil, beef",3,Baked Dishes
tacos,"tortilla, beef, cheese, salsa, lettuce",6,Grilled & Roasted
bbq ribs,"garlic, pork, spices, bbq sauce, brown sugar",2,Curries & Stews
bbq ribs,"garlic, spices, pork, brown sugar",2,Curries & Stews
pancakes,"sugar, vanilla, eggs, butter, milk, flour",0,Salads & Wraps
omelette,"onions, salt, pepper, cheese",5,Breakfast & Brunch
pancakes,"vanilla, flour, sugar, butter, egg",0,Salads & Wraps
turkey sandwich,"mayonnaise, turkey, lettuce, cheese, tomato",6,Grilled & Roasted
chicken biryani,"chicken, rice, spices, cardamom, yogurt",2,Curries & Stews
omelette,"cheese, eggs, onions, butter",5,Breakfast & Brunch
clam chowder,"onion, potato, celery, cream",1,Desserts & Pastries
caesar salad,"lettuce, caesar dressing, chicken, parmesan",6,Grilled & Roasted
bbq ribs,"garlic, spices, pork, bbq sauce, brown sugar",2,Curries & Stews
pho,"basil, beef, broth, chili, rice noodles, lime",3,Baked Dishes
shawarma,"garlic, pita, chicken, cumin, yogurt",2,Curries & Stews
japanese ramen,"noodles, ginger, pork, broth, egg, scallion",4,Asian & Stir Fry
pad thai,"peanut, rice noodles, lime, shrimp",3,Baked Dishes
pancakes,"milk, eggs, butter, vanilla, flour",0,Salads & Wraps
pho,"rice noodles, broth, beef, basil, lime",3,Baked Dishes
lasagna,"cheese, ground beef, onion, tomato sauce, garlic, pasta",1,Desserts & Pastries
tacos,"beef, salsa, lettuce, cheese, tortilla",6,Grilled & Roasted
tacos,"cheese, lettuce, tortilla, beef",6,Grilled & Roasted
cereal,"milk, oats, honey, nuts, fruit",0,Salads & Wraps
omelette,"pepper, cheese, eggs, salt",5,Breakfast & Brunch
pasta carbonara,"pasta, cheese, basil, tomato sauce, olive oil",1,Desserts & Pastries
spanish paella,"rice, onions, peppers, seafood, saffron",2,Curries & Stews
japanese ramen,"broth, noodles, egg, pork, scallion",4,Asian & Stir Fry
bbq ribs,"garlic, pork, bbq sauce, spices, brown sugar",2,Curries & Stews
japanese ramen,"broth, ginger, scallions, egg, pork",4,Asian & Stir Fry
greek salad,"olives, tomato, cucumber, feta cheese",6,Grilled & Roasted
caesar salad,"lettuce, parmesan, caesar dressing, chicken, crouton",6,Grilled & Roasted
pho,"chili, broth, rice noodles, lime, beef",3,Baked Dishes
japanese ramen,"ginger, broth, egg, scallions, noodles, pork",4,Asian & Stir Fry
chicken biryani,"rice, saffron, spices, yogurt, chicken, cardamom",2,Curries & Stews
chicken biryani,"yogurt, chicken, spices, saffron, rice, cardamom",2,Curries & Stews
dim sum,"soy sauce, dumpling wrapper, pork, ginger",4,Asian & Stir Fry
pancakes,"eggs, sugar, vanilla, butter, flour, milk",0,Salads & Wraps
greek salad,"dressing, lettuce, feta cheese, olives, tomato",6,Grilled & Roasted
cereal,"nuts, milk, fruits, honey",0,Salads & Wraps
sushi,"avocado, soy sauce, salmon, rice, seaweed",2,Curries & Stews
shawarma,"chicken, yogurt, pita, cumin, garlic",2,Curries & Stews
japanese ramen,"broth, scallions, noodles, ginger",4,Asian & Stir Fry
japanese ramen,"ginger, broth, pork, scallions, egg",4,Asian & Stir Fry
bbq ribs,"bbq sauce, garlic, brown sugar, spices, pork",2,Curries & Stews
turkey sandwich,"mayonnaise, bread, cheese, turkey",6,Grilled & Roasted
shawarma,"garlic, pita, cumin, chicken",2,Curries & Stews
grilled chicken,"tomato, garlic, chicken, seasoning",6,Grilled & Roasted
lasagna,"cheese, tomato sauce, garlic, ground beef",1,Desserts & Pastries
lasagna,"pasta, ground beef, onion, garlic, cheese, tomato sauce",1,Desserts & Pastries
pho,"rice noodles, chili, lime, broth, beef",3,Baked Dishes
greek salad,"olives, feta cheese, dressing, cucumber, tomato",6,Grilled & Roasted
cereal,"fruits, honey, nuts, oat",0,Salads & Wraps
sushi,"rice, seaweed, soy sauce, avocado, salmon",2,Curries & Stews
pancakes,"butter, flour, sugar, egg",0,Salads & Wraps
lasagna,"tomato sauce, onion, cheese, garlic, pasta",1,Desserts & Pastries
spanish paella,"peppers, seafood, onions, rice, saffron",2,Curries & Stews
chicken biryani,"spices, yogurt, rice, cardamom",2,Curries & Stews
dim sum,"ginger, soy sauce, dumpling wrapper, pork",4,Asian & Stir Fry
clam chowder,"cream, potato, clam, onion",1,Desserts & Pastries
shawarma,"chicken, pita, cumin, garlic, yogurt",2,Curries & Stews
spanish paella,"rice, saffron, onions, seafood, pepper",2,Curries & Stews
lasagna,"garlic, tomato sauce, cheese, pasta, ground beef, onion",1,Desserts & Pastries
cereal,"honey, milk, fruits, nuts, oat",0,Salads & Wraps
bbq ribs,"spices, garlic, pork, bbq sauce",2,Curries & Stews
japanese ramen,"broth, pork, scallions, egg, ginger, noodle",4,Asian & Stir Fry
butter chicken,"chicken, coconut milk, curry powder, spices, onion",2,Curries & Stews
pancakes,"milk, flour, sugar, butter",0,Salads & Wraps
lasagna,"pasta, tomato sauce, onion, ground beef",1,Desserts & Pastries
clam chowder,"potato, onion, cream, clam, celery",1,Desserts & Pastries
omelette,"butter, pepper, salt, cheese",5,Breakfast & Brunch
omelette,"pepper, salt, cheese, onion",5,Breakfast & Brunch
pho,"rice noodles, chili, lime, beef, basil, broth",3,Baked Dishes
chicken biryani,"spices, cardamom, saffron, yogurt, rice, chicken",2,Curries & Stews
spanish paella,"seafood, peppers, saffron, rice",2,Curries & Stews
greek salad,"cucumber, lettuce, olives, dressing, tomato, feta cheese",6,Grilled & Roasted
greek salad,"olives, cucumber, lettuce, feta cheese, tomato",6,Grilled & Roasted
sushi,"soy sauce, avocado, seaweed, salmon, rice",2,Curries & Stews
spanish paella,"saffron, rice, peppers, onions, seafood",2,Curries & Stews
clam chowder,"cream, clam, celery, potato, onion",1,Desserts & Pastries
bbq ribs,"brown sugar, pork, spices, garlic, bbq sauce",2,Curries & Stews
pancakes,"sugar, milk, butter, egg",0,Salads & Wraps
cereal,"oats, honey, milk, nut",0,Salads & Wraps
japanese ramen,"noodles, ginger, pork, broth, egg",4,Asian & Stir Fry
spanish paella,"seafood, peppers, onions, rice, saffron",2,Curries & Stews
shawarma,"garlic, cumin, yogurt, pita",2,Curries & Stews
sushi,"soy sauce, seaweed, rice, salmon, avocado",2,Curries & Stews
cereal,"milk, fruits, nuts, oats, honey",0,Salads & Wraps
pancakes,"sugar, vanilla, flour, milk, butter, egg",0,Salads & Wraps
japanese ramen,"pork, egg, broth, noodles, ginger, scallion",4,Asian & Stir Fry
greek salad,"tomato, feta cheese, cucumber, olive",6,Grilled & Roasted
omelette,"butter, eggs, onions, pepper",5,Breakfast & Brunch
pancakes,"vanilla, sugar, flour, eggs, butter",0,Salads & Wraps
chicken biryani,"rice, spices, chicken, saffron, cardamom, yogurt",2,Curries & Stews
omelette,"cheese, pepper, eggs, butter",5,Breakfast & Brunch
pancakes,"eggs, butter, flour, milk, sugar",0,Salads & Wraps
clam chowder,"onion, clam, potato, cream",1,Desserts & Pastries
spring rolls,"carrots, rice paper, peanut sauce, shrimp",3,Baked Dishes
beef steak,"beef, salt, butter, garlic, pepper",5,Breakfast & Brunch
pasta carbonara,"pasta, olive oil, basil, tomato sauce, cheese",1,Desserts & Pastries
pho,"beef, broth, rice noodles, basil",3,Baked Dishes
chicken biryani,"rice, chicken, spices, saffron, yogurt",2,Curries & Stews
omelette,"cheese, salt, butter, onions, eggs, pepper",5,Breakfast & Brunch
cereal,"oats, honey, nuts, fruit",0,Salads & Wraps
pasta carbonara,"basil, tomato sauce, pasta, cheese, olive oil",1,Desserts & Pastries
japanese ramen,"pork, egg, ginger, scallion",4,Asian & Stir Fry
cereal,"honey, milk, oats, nut",0,Salads & Wraps
greek salad,"feta cheese, olives, tomato, cucumber, lettuce, dressing",6,Grilled & Roasted
greek salad,"olives, lettuce, dressing, feta cheese",6,Grilled & Roasted
spanish paella,"seafood, onions, rice, pepper",2,Curries & Stews
cereal,"oats, honey, fruits, milk, nut",0,Salads & Wraps
beef steak,"salt, beef, garlic, butter",5,Breakfast & Brunch
sushi,"soy sauce, salmon, seaweed, avocado, rice",2,Curries & Stews
pad thai,"rice noodles, peanut, shrimp, egg, lime",3,Baked Dishes
omelette,"onions, pepper, cheese, butter, salt",5,Breakfast & Brunch
shawarma,"chicken, yogurt, cumin, pita",2,Curries & Stews
caesar salad,"lettuce, croutons, caesar dressing, parmesan",6,Grilled & Roasted
spring rolls,"rice paper, peanut sauce, cabbage, carrots, shrimp",3,Baked Dishes
grilled chicken,"tomato, seasoning, lettuce, garlic, chicken",6,Grilled & Roasted
spring rolls,"shrimp, peanut sauce, cabbage, carrots, rice paper",3,Baked Dishes
pad thai,"egg, shrimp, rice noodles, peanut, lime",3,Baked Dishes
greek salad,"feta cheese, dressing, olives, tomato, cucumber",6,Grilled & Roasted
butter chicken,"onions, chicken, curry powder, spice",2,Curries & Stews
pho,"beef, basil, broth, lime",3,Baked Dishes
greek salad,"lettuce, cucumber, olives, dressing",6,Grilled & Roasted
lasagna,"garlic, cheese, ground beef, pasta",1,Desserts & Pastries
cereal,"oats, milk, honey, fruit",0,Salads & Wraps
japanese ramen,"pork, egg, broth, noodles, scallions, ginger",4,Asian & Stir Fry
pasta carbonara,"tomato sauce, cheese, basil, pasta, olive oil",1,Desserts & Pastries
greek salad,"tomato, olives, dressing, lettuce, cucumber",6,Grilled & Roasted
greek salad,"cucumber, olives, lettuce, dressing, feta cheese, tomato",6,Grilled & Roasted
spring rolls,"peanut sauce, cabbage, shrimp, carrots, rice paper",3,Baked Dishes
sushi,"salmon, rice, seaweed, soy sauce, avocado",2,Curries & Stews
grilled chicken,"garlic, seasoning, chicken, lettuce",6,Grilled & Roasted
japanese ramen,"broth, egg, ginger, pork, scallion",4,Asian & Stir Fry
clam chowder,"cream, onion, potato, celery, clam",1,Desserts & Pastries
lasagna,"pasta, garlic, cheese, ground beef, onion",1,Desserts & Pastries
japanese ramen,"pork, scallions, noodles, ginger, broth",4,Asian & Stir Fry
clam chowder,"potato, clam, onion, celery",1,Desserts & Pastries
shawarma,"garlic, chicken, yogurt, cumin, pita",2,Curries & Stews
lasagna,"cheese, ground beef, onion, garlic, pasta, tomato sauce",1,Desserts & Pastries
pasta carbonara,"tomato sauce, pasta, basil, cheese",1,Desserts & Pastries
dim sum,"ginger, pork, soy sauce, dumpling wrapper",4,Asian & Stir Fry
beef steak,"pepper, salt, butter, garlic",5,Breakfast & Brunch
spanish paella,"peppers, saffron, seafood, onions, rice",2,Curries & Stews
pancakes,"eggs, butter, milk, sugar",0,Salads & Wraps
lasagna,"pasta, tomato sauce, ground beef, garlic, cheese, onion",1,Desserts & Pastries
chicken biryani,"yogurt, saffron, chicken, spices, rice",2,Curries & Stews
pad thai,"lime, egg, peanut, rice noodles, shrimp",3,Baked Dishes
omelette,"butter, onions, salt, pepper, egg",5,Breakfast & Brunch
pho,"basil, chili, lime, rice noodles, beef, broth",3,Baked Dishes
turkey sandwich,"turkey, cheese, tomato, bread",6,Grilled & Roasted
omelette,"pepper, cheese, eggs, butter",5,Breakfast & Brunch
beef steak,"garlic, pepper, beef, salt, butter",5,Breakfast & Brunch
omelette,"onions, cheese, butter, pepper, egg",5,Breakfast & Brunch
butter chicken,"onions, curry powder, coconut milk, chicken",2,Curries & Stews
pancakes,"butter, flour, vanilla, milk",0,Salads & Wraps
tacos,"lettuce, beef, salsa, cheese",6,Grilled & Roasted
japanese ramen,"scallions, noodles, egg, broth, ginger, pork",4,Asian & Stir Fry
omelette,"pepper, onions, cheese, salt, butter, egg",5,Breakfast & Brunch
sushi,"salmon, avocado, rice, seaweed",2,Curries & Stews
pad thai,"lime, rice noodles, peanut, shrimp, egg",3,Baked Dishes
pho,"broth, beef, rice noodles, basil, chili, lime",3,Baked Dishes
pancakes,"butter, milk, eggs, sugar, vanilla, flour",0,Salads & Wraps
chicken biryani,"yogurt, cardamom, spices, chicken, rice, saffron",2,Curries & Stews
pho,"basil, chili, beef, rice noodle",3,Baked Dishes
omelette,"onions, eggs, butter, salt, cheese, pepper",5,Breakfast & Brunch
lasagna,"cheese, pasta, tomato sauce, garlic, ground beef, onion",1,Desserts & Pastries
dim sum,"ginger, pork, soy sauce, shrimp, dumpling wrapper",4,Asian & Stir Fry
pho,"broth, rice noodles, chili, lime, beef, basil",3,Baked Dishes
japanese ramen,"egg, noodles, broth, ginger, scallions, pork",4,Asian & Stir Fry
pasta carbonara,"cheese, pasta, tomato sauce, basil",1,Desserts & Pastries
pancakes,"milk, flour, butter, sugar",0,Salads & Wraps
pad thai,"lime, peanut, egg, rice noodles, shrimp",3,Baked Dishes
grilled chicken,"chicken, tomato, seasoning, lettuce, garlic",6,Grilled & Roasted
japanese ramen,"scallions, broth, noodles, pork, egg, ginger",4,Asian & Stir Fry
lasagna,"ground beef, tomato sauce, onion, garlic, cheese, pasta",1,Desserts & Pastries
pad thai,"rice noodles, shrimp, egg, lime",3,Baked Dishes
sushi,"avocado, seaweed, salmon, soy sauce, rice",2,Curries & Stews
japanese ramen,"ginger, egg, broth, scallions, noodle",4,Asian & Stir Fry
lasagna,"pasta, ground beef, onion, cheese",1,Desserts & Pastries
chicken biryani,"saffron, rice, chicken, yogurt, spice",2,Curries & Stews
lasagna,"pasta, ground beef, garlic, cheese, tomato sauce, onion",1,Desserts & Pastries
bbq ribs,"spices, pork, brown sugar, bbq sauce",2,Curries & Stews
turkey sandwich,"lettuce, tomato, turkey, bread",6,Grilled & Roasted
pad thai,"shrimp, egg, rice noodles, peanut, lime",3,Baked Dishes
greek salad,"olives, feta cheese, dressing, tomato",6,Grilled & Roasted
omelette,"onions, eggs, cheese, pepper, salt",5,Breakfast & Brunch
tacos,"cheese, beef, lettuce, salsa, tortilla",6,Grilled & Roasted
shawarma,"garlic, pita, cumin, yogurt",2,Curries & Stews
turkey sandwich,"bread, tomato, turkey, mayonnaise",6,Grilled & Roasted
pancakes,"sugar, butter, milk, flour, vanilla, egg",0,Salads & Wraps
grilled chicken,"garlic, lettuce, seasoning, chicken, tomato",6,Grilled & Roasted
dim sum,"soy sauce, dumpling wrapper, ginger, pork",4,Asian & Stir Fry
tacos,"tortilla, salsa, beef, cheese",6,Grilled & Roasted
greek salad,"cucumber, tomato, lettuce, feta cheese, dressing",6,Grilled & Roasted
chicken biryani,"yogurt, spices, cardamom, chicken",2,Curries & Stews
omelette,"eggs, onions, cheese, salt, pepper, butter",5,Breakfast & Brunch
turkey sandwich,"turkey, lettuce, bread, tomato",6,Grilled & Roasted
spring rolls,"peanut sauce, rice paper, carrots, cabbage, shrimp",3,Baked Dishes
omelette,"cheese, onions, pepper, egg",5,Breakfast & Brunch
pho,"broth, chili, basil, lime",3,Baked Dishes
clam chowder,"celery, clam, cream, onion",1,Desserts & Pastries
bbq ribs,"bbq sauce, spices, pork, brown sugar",2,Curries & Stews
spanish paella,"peppers, saffron, seafood, onion",2,Curries & Stews
chicken biryani,"spices, cardamom, rice, saffron, yogurt",2,Curries & Stews
spanish paella,"onions, peppers, rice, seafood",2,Curries & Stews
pho,"broth, beef, rice noodles, basil, lime, chili",3,Baked Dishes
cereal,"honey, milk, oats, nuts, fruit",0,Salads & Wraps
butter chicken,"chicken, coconut milk, spices, onion",2,Curries & Stews
grilled chicken,"garlic, tomato, lettuce, seasoning",6,Grilled & Roasted
turkey sandwich,"tomato, turkey, bread, lettuce",6,Grilled & Roasted
pad thai,"egg, rice noodles, shrimp, peanut",3,Baked Dishes
pho,"broth, basil, chili, rice noodles, lime, beef",3,Baked Dishes
butter chicken,"coconut milk, chicken, onions, spice",2,Curries & Stews
caesar salad,"croutons, caesar dressing, parmesan, chicken",6,Grilled & Roasted
spanish paella,"onions, rice, saffron, pepper",2,Curries & Stews
cereal,"milk, oats, nuts, honey, fruit",0,Salads & Wraps
turkey sandwich,"mayonnaise, bread, turkey, cheese, lettuce",6,Grilled & Roasted
tacos,"lettuce, salsa, beef, tortilla",6,Grilled & Roasted
pancakes,"eggs, vanilla, sugar, flour, butter",0,Salads & Wraps
omelette,"pepper, cheese, eggs, butter, onion",5,Breakfast & Brunch
omelette,"pepper, eggs, salt, cheese, butter, onion",5,Breakfast & Brunch
lasagna,"cheese, garlic, ground beef, pasta, onion",1,Desserts & Pastries
japanese ramen,"broth, egg, ginger, pork, scallions, noodle",4,Asian & Stir Fry
sushi,"seaweed, avocado, soy sauce, rice, salmon",2,Curries & Stews
omelette,"butter, pepper, cheese, egg",5,Breakfast & Brunch
chicken biryani,"chicken, rice, spices, cardamom, saffron, yogurt",2,Curries & Stews
grilled chicken,"lettuce, garlic, tomato, seasoning, chicken",6,Grilled & Roasted
bbq ribs,"bbq sauce, spices, garlic, brown sugar, pork",2,Curries & Stews
pasta carbonara,"cheese, tomato sauce, pasta, basil",1,Desserts & Pastries
beef steak,"beef, butter, pepper, garlic, salt",5,Breakfast & Brunch
greek salad,"olives, lettuce, dressing, tomato, feta cheese, cucumber",6,Grilled & Roasted
pancakes,"vanilla, eggs, butter, sugar, milk",0,Salads & Wraps
sushi,"soy sauce, seaweed, avocado, salmon, rice",2,Curries & Stews
omelette,"eggs, salt, cheese, onion",5,Breakfast & Brunch
greek salad,"feta cheese, tomato, lettuce, dressing",6,Grilled & Roasted
bbq ribs,"brown sugar, bbq sauce, spices, pork",2,Curries & Stews
spring rolls,"carrots, shrimp, cabbage, rice paper",3,Baked Dishes
japanese ramen,"pork, scallions, broth, noodles, ginger",4,Asian & Stir Fry
turkey sandwich,"lettuce, bread, tomato, cheese, turkey",6,Grilled & Roasted
omelette,"butter, eggs, pepper, onions, cheese, salt",5,Breakfast & Brunch
omelette,"salt, cheese, onions, egg",5,Breakfast & Brunch
pasta carbonara,"cheese, olive oil, tomato sauce, pasta",1,Desserts & Pastries
omelette,"butter, cheese, pepper, onion",5,Breakfast & Brunch
sushi,"seaweed, avocado, salmon, soy sauce, rice",2,Curries & Stews
pancakes,"sugar, flour, milk, butter",0,Salads & Wraps
pancakes,"flour, sugar, butter, milk, vanilla, egg",0,Salads & Wraps
sushi,"soy sauce, salmon, rice, avocado, seaweed",2,Curries & Stews
greek salad,"lettuce, feta cheese, tomato, olive",6,Grilled & Roasted
bbq ribs,"garlic, bbq sauce, brown sugar, spices, pork",2,Curries & Stews
pasta carbonara,"tomato sauce, basil, olive oil, pasta",1,Desserts & Pastries
spanish paella,"onions, saffron, peppers, rice",2,Curries & Stews
lasagna,"cheese, garlic, onion, tomato sauce, pasta",1,Desserts & Pastries
cereal,"milk, fruits, oats, nut",0,Salads & Wraps
caesar salad,"lettuce, caesar dressing, croutons, parmesan",6,Grilled & Roasted
bbq ribs,"bbq sauce, garlic, spices, brown sugar, pork",2,Curries & Stews
pancakes,"flour, milk, eggs, butter, vanilla",0,Salads & Wraps
omelette,"onions, butter, eggs, salt, pepper",5,Breakfast & Brunch
pancakes,"milk, eggs, butter, flour",0,Salads & Wraps
clam chowder,"celery, potato, cream, onion",1,Desserts & Pastries
dim sum,"soy sauce, ginger, dumpling wrapper, pork",4,Asian & Stir Fry
pasta carbonara,"tomato sauce, basil, olive oil, cheese",1,Desserts & Pastries
omelette,"eggs, salt, cheese, pepper",5,Breakfast & Brunch
shawarma,"cumin, garlic, chicken, yogurt, pita",2,Curries & Stews
pho,"lime, chili, rice noodles, broth, basil, beef",3,Baked Dishes
japanese ramen,"scallions, noodles, broth, egg, ginger",4,Asian & Stir Fry
spring rolls,"rice paper, carrots, shrimp, cabbage, peanut sauce",3,Baked Dishes
cereal,"milk, nuts, honey, fruit",0,Salads & Wraps
pancakes,"vanilla, flour, milk, sugar, butter, egg",0,Salads & Wraps
turkey sandwich,"mayonnaise, lettuce, tomato, bread, turkey, cheese",6,Grilled & Roasted
bbq ribs,"pork, bbq sauce, garlic, spice",2,Curries & Stews
pho,"rice noodles, beef, broth, chili, basil, lime",3,Baked Dishes
pad thai,"shrimp, egg, lime, rice noodles, peanut",3,Baked Dishes
spring rolls,"peanut sauce, rice paper, cabbage, carrots, shrimp",3,Baked Dishes
omelette,"onions, butter, pepper, eggs, salt, cheese",5,Breakfast & Brunch
clam chowder,"celery, onion, potato, cream",1,Desserts & Pastries
greek salad,"cucumber, olives, lettuce, feta cheese, tomato, dressing",6,Grilled & Roasted
chicken biryani,"chicken, saffron, spices, cardamom",2,Curries & Stews
shawarma,"pita, chicken, garlic, yogurt",2,Curries & Stews
greek salad,"cucumber, dressing, olives, tomato",6,Grilled & Roasted
tacos,"salsa, beef, cheese, tortilla",6,Grilled & Roasted
japanese ramen,"scallions, pork, noodles, broth, ginger",4,Asian & Stir Fry
shawarma,"pita, yogurt, garlic, chicken",2,Curries & Stews
pasta carbonara,"pasta, cheese, basil, olive oil",1,Desserts & Pastries
japanese ramen,"egg, noodles, pork, scallions, broth, ginger",4,Asian & Stir Fry
greek salad,"lettuce, olives, cucumber, feta cheese",6,Grilled & Roasted
beef steak,"garlic, pepper, beef, butter",5,Breakfast & Brunch
chicken biryani,"spices, chicken, cardamom, yogurt",2,Curries & Stews
pho,"broth, rice noodles, lime, chili",3,Baked Dishes
dim sum,"dumpling wrapper, soy sauce, shrimp, pork",4,Asian & Stir Fry
tacos,"beef, tortilla, salsa, cheese",6,Grilled & Roasted
beef steak,"salt, garlic, butter, pepper",5,Breakfast & Brunch
dim sum,"pork, dumpling wrapper, shrimp, ginger",4,Asian & Stir Fry
pad thai,"egg, shrimp, rice noodles, peanut",3,Baked Dishes
grilled chicken,"chicken, tomato, garlic, lettuce, seasoning",6,Grilled & Roasted
spanish paella,"rice, peppers, onions, saffron, seafood",2,Curries & Stews
lasagna,"pasta, onion, garlic, ground beef, tomato sauce",1,Desserts & Pastries
japanese ramen,"ginger, pork, egg, broth",4,Asian & Stir Fry
bbq ribs,"garlic, spices, pork, bbq sauce",2,Curries & Stews
spring rolls,"rice paper, cabbage, carrots, peanut sauce, shrimp",3,Baked Dishes
tacos,"tortilla, beef, lettuce, cheese, salsa",6,Grilled & Roasted
pho,"rice noodles, lime, basil, broth, chili, beef",3,Baked Dishes
pancakes,"eggs, sugar, butter, vanilla",0,Salads & Wraps
sushi,"avocado, soy sauce, seaweed, salmon",2,Curries & Stews
lasagna,"ground beef, pasta, onion, tomato sauce, cheese, garlic",1,Desserts & Pastries
pho,"rice noodles, lime, beef, chili, broth",3,Baked Dishes
pad thai,"rice noodles, shrimp, egg, lime, peanut",3,Baked Dishes
pancakes,"vanilla, sugar, butter, milk",0,Salads & Wraps
omelette,"butter, salt, eggs, pepper, cheese",5,Breakfast & Brunch
pancakes,"milk, sugar, eggs, flour, butter, vanilla",0,Salads & Wraps
japanese ramen,"egg, broth, pork, scallions, ginger, noodle",4,Asian & Stir Fry
greek salad,"lettuce, cucumber, feta cheese, dressing, olives, tomato",6,Grilled & Roasted
grilled chicken,"seasoning, tomato, lettuce, chicken",6,Grilled & Roasted
clam chowder,"potato, cream, clam, celery",1,Desserts & Pastries
lasagna,"garlic, onion, ground beef, tomato sauce, cheese",1,Desserts & Pastries
grilled chicken,"lettuce, tomato, garlic, seasoning",6,Grilled & Roasted
bbq ribs,"pork, garlic, brown sugar, spice",2,Curries & Stews
japanese ramen,"egg, pork, broth, ginger, scallion",4,Asian & Stir Fry
chicken biryani,"cardamom, saffron, chicken, yogurt",2,Curries & Stews
greek salad,"lettuce, cucumber, tomato, dressing",6,Grilled & Roasted
pho,"chili, lime, beef, broth",3,Baked Dishes
japanese ramen,"pork, ginger, egg, scallions, broth, noodle",4,Asian & Stir Fry
lasagna,"tomato sauce, garlic, ground beef, onion, cheese, pasta",1,Desserts & Pastries
butter chicken,"spices, curry powder, chicken, coconut milk",2,Curries & Stews
caesar salad,"chicken, caesar dressing, croutons, parmesan",6,Grilled & Roasted
lasagna,"pasta, ground beef, garlic, onion, tomato sauce, cheese",1,Desserts & Pastries
beef steak,"salt, butter, beef, pepper",5,Breakfast & Brunch
sushi,"soy sauce, rice, seaweed, avocado",2,Curries & Stews
tacos,"cheese, tortilla, lettuce, beef, salsa",6,Grilled & Roasted
lasagna,"garlic, ground beef, cheese, onion, pasta",1,Desserts & Pastries
pad thai,"peanut, lime, egg, rice noodle",3,Baked Dishes
clam chowder,"clam, celery, potato, cream, onion",1,Desserts & Pastries
lasagna,"ground beef, tomato sauce, onion, cheese",1,Desserts & Pastries
bbq ribs,"garlic, spices, brown sugar, pork",2,Curries & Stews
greek salad,"lettuce, olives, feta cheese, cucumber, tomato, dressing",6,Grilled & Roasted
dim sum,"dumpling wrapper, soy sauce, ginger, pork",4,Asian & Stir Fry
omelette,"butter, cheese, salt, onion",5,Breakfast & Brunch
pho,"chili, basil, rice noodles, beef, lime",3,Baked Dishes
omelette,"cheese, pepper, eggs, salt",5,Breakfast & Brunch
turkey sandwich,"bread, cheese, mayonnaise, lettuce, turkey, tomato",6,Grilled & Roasted
shawarma,"yogurt, pita, cumin, garlic, chicken",2,Curries & Stews
greek salad,"cucumber, olives, feta cheese, tomato",6,Grilled & Roasted
omelette,"cheese, eggs, butter, salt, pepper",5,Breakfast & Brunch
japanese ramen,"egg, ginger, pork, scallions, broth, noodle",4,Asian & Stir Fry
turkey sandwich,"turkey, bread, tomato, mayonnaise, cheese, lettuce",6,Grilled & Roasted
greek salad,"lettuce, dressing, feta cheese, olive",6,Grilled & Roasted
pad thai,"rice noodles, egg, shrimp, lime, peanut",3,Baked Dishes
pancakes,"milk, butter, vanilla, flour, sugar",0,Salads & Wraps
lasagna,"tomato sauce, ground beef, cheese, garlic, onion",1,Desserts & Pastries
